{
  "schemaVersion": "finance-asset-catalog.v1",
  "catalogVersion": "0.2.11",
  "runtimeIntegrations": [
    {
      "id": "openjiuwen-java",
      "version": "0.1.0-SNAPSHOT",
      "displayName": "OpenJiuwen Java Integration",
      "source": "repo://integrations/openjiuwen-java",
      "artifactRef": "maven://io.github.bitlhk.finance:finance-harness-openjiuwen-java:0.1.0-SNAPSHOT",
      "governanceRef": "finance-harness-integration",
      "compatibility": {
        "runtimeFamilies": [
          "openjiuwen"
        ],
        "runtimeLanguages": [
          "java"
        ]
      }
    },
    {
      "id": "employee-agent-java",
      "version": "0.1.0-SNAPSHOT",
      "displayName": "Employee Agent Java Host Integration",
      "source": "repo://integrations/employee-agent-java",
      "artifactRef": "maven://io.github.bitlhk.finance:finance-integration-employee-agent-java:0.1.0-SNAPSHOT",
      "governanceRef": "finance-harness-integration",
      "compatibility": {
        "runtimeFamilies": [
          "openjiuwen"
        ],
        "runtimeLanguages": [
          "java"
        ],
        "profiles": [
          "employee-assisted"
        ]
      }
    },
    {
      "id": "customer-manager-java",
      "version": "0.1.0-SNAPSHOT",
      "displayName": "Customer Manager Service Preparation Java Integration",
      "source": "repo://integrations/customer-manager-java",
      "artifactRef": "maven://io.github.bitlhk.finance:finance-integration-customer-manager-java:0.1.0-SNAPSHOT",
      "governanceRef": "finance-harness-integration",
      "compatibility": {
        "runtimeFamilies": ["openjiuwen"],
        "runtimeLanguages": ["java"],
        "profiles": ["employee-assisted"]
      }
    }
  ],
  "profiles": [
    {
      "id": "shared-read-only",
      "version": "0.1.0",
      "displayName": "共同财富只读（候选）",
      "source": "repo://profiles/shared-read-only.md",
      "governanceRef": "finance-harness-core"
    },
    {
      "id": "customer-self-service",
      "version": "0.1.0",
      "displayName": "客户自服务",
      "source": "repo://profiles",
      "governanceRef": "finance-harness-core"
    },
    {
      "id": "employee-assisted",
      "version": "0.1.0",
      "displayName": "员工辅助",
      "source": "repo://profiles/employee-assisted.md",
      "governanceRef": "finance-harness-core"
    },
    {
      "id": "internal-control",
      "version": "0.1.0",
      "displayName": "内部审核",
      "source": "repo://profiles/internal-control.md",
      "governanceRef": "finance-harness-core"
    },
    {
      "id": "cashflow-read-only",
      "version": "0.1.0",
      "displayName": "收支只读（候选）",
      "source": "repo://profiles/cashflow-read-only.md",
      "governanceRef": "finance-harness-core"
    },
    {
      "id": "local-read-only",
      "version": "0.1.0",
      "displayName": "本地客户只读宿主",
      "source": "repo://profiles/local-read-only.md",
      "governanceRef": "finance-harness-core"
    },
    {
      "id": "local-simulator-task",
      "version": "0.1.0",
      "displayName": "本地模拟银行受控办理",
      "source": "repo://profiles/local-simulator-task.md",
      "governanceRef": "finance-harness-core"
    }
  ],
  "domainPacks": [
    {
      "id": "wealth-service-preparation",
      "version": "0.1.0",
      "displayName": "客户经理访前服务准备（待宿主验收）",
      "profile": "employee-assisted",
      "source": "repo://domain-packs/wealth/service-preparation",
      "governanceRef": "finance-harness-core",
      "requiresCapabilities": ["wealth.previsit-context.query"],
      "dependencies": [
        {"kind": "capability-pack", "id": "wealth-manager-previsit", "version": "0.1.0"}
      ],
      "compatibility": {"profiles": ["employee-assisted"]}
    },
    {
      "id": "wealth-shared-facts",
      "version": "0.1.1",
      "displayName": "财富事实描述（候选）",
      "profile": "shared-read-only",
      "source": "repo://domain-packs/wealth/shared-facts",
      "governanceRef": "finance-harness-core",
      "requiresCapabilities": [
        "wealth.facts.describe"
      ],
      "dependencies": [
        {
          "kind": "capability-pack",
          "id": "wealth-facts-description",
          "version": "0.1.0"
        }
      ],
      "compatibility": {
        "profiles": [
          "shared-read-only",
          "local-read-only",
          "local-simulator-task"
        ]
      }
    },
    {
      "id": "wealth-customer-self-service",
      "version": "0.1.0",
      "displayName": "客户财富诊断",
      "profile": "customer-self-service",
      "source": "repo://domain-packs/wealth/customer-self-service",
      "governanceRef": "finance-harness-core",
      "requiresCapabilities": [
        "wealth.customer-context.query"
      ],
      "dependencies": [
        {
          "kind": "capability-pack",
          "id": "wealth-customer-context",
          "version": "0.1.0"
        }
      ],
      "compatibility": {
        "profiles": [
          "customer-self-service"
        ]
      }
    },
    {
      "id": "wealth-employee-assisted",
      "version": "0.1.0",
      "displayName": "财富经理访前诊断",
      "profile": "employee-assisted",
      "source": "repo://domain-packs/wealth/employee-assisted",
      "governanceRef": "finance-harness-core",
      "requiresCapabilities": [
        "wealth.previsit-context.query"
      ],
      "dependencies": [
        {
          "kind": "capability-pack",
          "id": "wealth-manager-previsit",
          "version": "0.1.0"
        }
      ],
      "compatibility": {
        "profiles": [
          "employee-assisted"
        ]
      }
    },
    {
      "id": "insurance-employee-assisted",
      "version": "0.1.0",
      "displayName": "保险顾问访前诊断",
      "profile": "employee-assisted",
      "source": "repo://domain-packs/insurance/employee-assisted",
      "governanceRef": "finance-harness-core",
      "requiresCapabilities": [
        "insurance.customer-context.query"
      ],
      "dependencies": [
        {
          "kind": "capability-pack",
          "id": "insurance-advisor-previsit",
          "version": "0.1.0"
        }
      ],
      "compatibility": {
        "profiles": [
          "employee-assisted"
        ]
      }
    },
    {
      "id": "risk-review-internal-control",
      "version": "0.1.0",
      "displayName": "转账风险审核",
      "profile": "internal-control",
      "source": "repo://domain-packs/risk/internal-control",
      "governanceRef": "finance-harness-core",
      "requiresCapabilities": [
        "account.balance.query",
        "fraud.transfer-risk.assess"
      ],
      "dependencies": [
        {
          "kind": "capability-pack",
          "id": "risk-review-basics",
          "version": "0.1.0"
        }
      ],
      "compatibility": {
        "profiles": [
          "internal-control"
        ]
      }
    },
    {
      "id": "transfer-anti-fraud",
      "version": "0.1.0",
      "displayName": "面客转账反诈",
      "profile": "customer-self-service",
      "source": "repo://domain-packs/anti-fraud",
      "governanceRef": "finance-harness-core",
      "requiresCapabilities": [
        "fraud.transfer-risk.assess"
      ],
      "dependencies": [
        {
          "kind": "capability-pack",
          "id": "risk-review-basics",
          "version": "0.1.0"
        }
      ],
      "compatibility": {
        "profiles": [
          "customer-self-service"
        ]
      }
    },
    {
      "id": "cashflow-customer-self-service",
      "version": "0.1.3",
      "displayName": "收支说明专业方法（候选）",
      "profile": "customer-self-service",
      "source": "repo://domain-packs/cashflow/customer-self-service",
      "governanceRef": "finance-harness-core",
      "requiresCapabilities": [
        "finance.transaction-summary.query",
        "finance.spending-analysis.query"
      ],
      "dependencies": [
        {
          "kind": "capability-pack",
          "id": "cashflow-readonly",
          "version": "0.1.0"
        }
      ],
      "compatibility": {
        "profiles": [
          "customer-self-service",
          "local-read-only",
          "local-simulator-task"
        ]
      }
    },
    {
      "id": "enterprise-credit-material-review",
      "version": "0.1.0",
      "displayName": "企业信贷材料核验辅助",
      "profile": "internal-control",
      "source": "repo://domain-packs/credit/enterprise-material-review",
      "governanceRef": "finance-harness-core",
      "requiresCapabilities": [
        "enterprise.financial-statement.verify",
        "enterprise.application-contract.verify"
      ],
      "dependencies": [
        {"kind": "capability-pack", "id": "enterprise-financial-statement-verification", "version": "0.1.0"},
        {"kind": "capability-pack", "id": "enterprise-application-contract-verification", "version": "0.1.0"}
      ],
      "compatibility": {
        "profiles": ["internal-control"],
        "runtimeFamilies": ["openjiuwen"],
        "runtimeLanguages": ["java"]
      }
    }
  ],
  "capabilityPacks": [
    {
      "id": "curated-synthetic-wealth",
      "version": "1.1.0",
      "displayName": "合成评测：财富资料（候选）",
      "source": "repo://capability-packs/curated-synthetic-wealth",
      "governanceRef": "finance-harness-core",
      "capabilities": [
        "eval.synthetic.get-customer-portfolio.query",
        "eval.synthetic.get-wealth-policy-basis.query",
        "eval.synthetic.prepare-wealth-allocation-context.query",
        "eval.synthetic.wealth-assistant-product-info.query"
      ],
      "compatibility": {
        "profiles": ["local-read-only"],
        "runtimeFamilies": ["openjiuwen", "agentscope"],
        "runtimeLanguages": ["java"]
      }
    },
    {
      "id": "curated-synthetic-customer",
      "version": "1.1.0",
      "displayName": "合成评测：客户资料",
      "source": "repo://capability-packs/curated-synthetic-customer",
      "governanceRef": "finance-harness-core",
      "capabilities": [
        "eval.synthetic.get-customer-profile.query"
      ],
      "compatibility": {
        "profiles": [